{
  "schemaVersion": 1,
  "environmentId": "local-dsh",
  "observedAtUnixMs": 1787792400100,
  "runtime": {
    "state": "healthy",
    "generation": 7,
    "readiness": "verified",
    "endpoint": {
      "host": "127.0.0.1",
      "port": 4317
    },
    "recovery": null
  },
  "surface": {
    "state": "ready",
    "platform": "windows",
    "generation": 7,
    "visible": true,
    "error": null
  },
  "catalog": {
    "revision": 12,
    "activeEnvironmentId": "local-dsh"
  },
  "process": {
    "retained": true,
    "owned": true
  },
  "evidence": [
    {
      "code": "DIAGNOSTICS_COLLECTED",
      "severity": "info",
      "message": "Diagnostics snapshot collected from Supervisor, Surface, catalog, and process state."
    },
    {
      "code": "MANAGED_ENDPOINT_VERIFIED",
      "severity": "info",
      "message": "The owned generation emitted an exact loopback endpoint and accepted a bounded TCP connection."
    },
    {
      "code": "PROCESS_RETAINED",
      "severity": "info",
      "message": "The Supervisor retains a Desktop-owned process tree."
    },
    {
      "code": "CATALOG_ACTIVE_ENVIRONMENT",
      "severity": "info",
      "message": "The diagnosed environment is the active catalog selection."
    }
  ]
}
